{
  "$schema": "../schemas/contracts_ast.schema.json",
  "version": "5.0",
  "project": "MetricsThinking",
  "updated_at": "2026-10-29T01:53:16.154987+00:00",
  "topology_hash": "916db87d0aabfedd169f2d4f73df058bed5572c3df73c07f72a4a81d6c5d7615",
  "contracts_ast_hash": "58696855c96ac76bf494921feb25456d456b0b78ee4818f96b172b7495ce9013",
  "public_symbols": [
    "MiniYAML",
    "safe_io_retry",
    "safe_rename_casing",
    "estimate_tokens_v4",
    "resolve_seed_key_files",
    "generate_beacon_content",
    "resolve_beacon",
    "extract_preserved_comments",
    "validate_beacon_data",
    "validate_tree_data",
    "validate_backlog_data",
    "validate_backlog_queue",
    "load_ignore_patterns",
    "is_ignored_path",
    "discover_unbeaconed_directories",
    "infer_beacon_meta",
    "scaffold_beacon_for_dir",
    "ensure_beacon_chain",
    "iter_beacon_files",
    "sync_beacons",
    "compute_topology_hash",
    "compute_node_fingerprint",
    "generate_tree_json",
    "check_satellite_freshness",
    "format_compact_tree_json",
    "sync_tree",
    "generate_sliced_tree",
    "format_sliced_tree",
    "build_context_pack",
    "get_seed_sections",
    "extract_seed_section",
    "manage_checkpoint",
    "build_ast_contracts_index",
    "sync_icontext_bus",
    "build_ecosystem_pack",
    "upsert_segmented_block",
    "compute_context_budget",
    "init_project",
    "inspect_python_header",
    "route_file",
    "reconcile_plans_lifecycle",
    "validate_dependency_dag",
    "audit_repository",
    "reconcile_repository",
    "main",
    "rebuild_hnsw_index",
    "get_user_home",
    "install_antigravity",
    "install_codex",
    "install_claude",
    "install_cursor",
    "install_copilot",
    "install_mcp_config",
    "run_installer",
    "list_available_profiles",
    "ProjectEvidence",
    "ProjectCollector",
    "ArchetypeScore",
    "ArchetypeDetectionResult",
    "ArchetypeDetector",
    "probe_archetype",
    "resolve_profile_name",
    "probe_project",
    "run_audit",
    "CriteriaEvaluator",
    "handle_list_tools",
    "handle_call_tool",
    "run_mcp_server",
    "DomainArchetype",
    "InspectionMode",
    "EvidencePrimitiveSummary",
    "ModuleStatus",
    "MaturityBand",
    "AuditCriterion",
    "CanonicalModuleEvaluation",
    "RemediationItem",
    "FPAISpectralVector",
    "SecurityVulnerabilityReport",
    "SystemsResilienceReport",
    "PruningActionItem",
    "ContextPruningPlan",
    "ProjectAuditReport",
    "ReportRenderer",
    "AuditScorer",
    "get_active_backend",
    "scan_directory",
    "fast_shannon_entropy",
    "calculate_shingling_jaccard",
    "compute_ast_coupling",
    "run_ablation_sampling",
    "resolve_context_attribution",
    "generate_pruning_plan",
    "apply_pruning_plan",
    "calculate_confidence_envelope",
    "audit_seed_to_code_drift",
    "calculate_shannon_entropy",
    "is_safe_placeholder",
    "scan_file_security",
    "scan_repository_security",
    "run_local_medallion_pipeline",
    "compute_spectral_vector",
    "test_sdd_archetype_detection",
    "test_data_platform_archetype_detection",
    "test_web_app_archetype_detection",
    "test_mlops_archetype_detection",
    "test_llmops_archetype_detection",
    "test_gitops_archetype_detection",
    "test_devsecops_archetype_detection",
    "test_agent_skill_pure_detection",
    "test_prevent_agents_md_false_positive",
    "test_custom_profile_extensibility",
    "test_emerging_domain_fallback",
    "test_active_backend_availability",
    "test_rust_crate_structure",
    "test_scan_directory_and_incremental_cache",
    "test_shingling_jaccard_backend",
    "test_ast_coupling_calculation",
    "test_single_pass_collector_integration",
    "test_volumetric_scale_benchmark",
    "test_ast_coupling_stress_benchmark",
    "test_golden_baseline_regression_snapshot",
    "test_self_audit_with_sdd_profile",
    "test_gitops_synthetic_repo_calibration",
    "test_mlops_synthetic_repo_calibration",
    "test_llmops_synthetic_repo_calibration",
    "test_engine_run_audit",
    "test_cli_main_invocation",
    "test_renderer_materializes_four_artifacts",
    "test_engine_run_audit_with_prune_and_medallion",
    "test_mcp_server_six_tools",
    "test_mcp_server_tool_calls",
    "test_collector_basic_scan",
    "test_collector_anti_fraud_seed_filtering",
    "test_collector_detects_ci_and_tests",
    "test_seed_to_code_drift_detection",
    "test_pruning_plan_generation",
    "test_apply_pruning_plan_reversibility",
    "test_evaluator_default_profile",
    "test_evaluator_detects_empty_repository",
    "test_v4_evaluation_rules_on_current_repo",
    "test_scorer_populates_v4_vectors",
    "test_shannon_entropy_calculation",
    "test_secret_detection_and_safe_placeholder",
    "test_pii_detection",
    "test_prompt_injection_detection",
    "test_scan_repository_security",
    "test_fpai_governance_yaml_contract",
    "test_requirements_hygiene",
    "test_pyproject_version_and_deps",
    "test_package_and_mcp_version_sync",
    "test_skeleton_directories_removed",
    "test_engine_readme_seed_link",
    "test_tree_json_hygiene",
    "test_install_antigravity_local",
    "test_install_codex_local",
    "test_install_claude",
    "test_install_cursor",
    "test_install_copilot",
    "test_install_mcp_config",
    "test_run_installer_all",
    "test_mcp_server_tools",
    "test_local_medallion_pipeline",
    "test_ablation_sampling",
    "test_context_attribution",
    "test_hnsw_index_rebuild_script",
    "test_models_instantiation",
    "test_fpai_manifest_and_telemetry_schemas_valid",
    "test_renderer_mermaid_syntax",
    "test_renderer_generates_markdown_and_roadmap",
    "test_golden_snapshot_regression",
    "test_scorer_overall_score_calculation",
    "test_spectral_vector_orthogonality_and_invariants",
    "test_spectral_vector_decoupled_gain",
    "test_spectral_vector_zero_tokens",
    "test_confidence_envelope",
    "test_profile_structure_and_weights",
    "test_profile_rule_dispatch",
    "test_thinking_seed_v3_detection",
    "test_universal_evidence_primitives",
    "test_agent_skill_auto_detection",
    "test_profile_alias_resolution"
  ],
  "cli_flags": [
    "--move",
    "--overwrite",
    "--base",
    "--sync",
    "--audit",
    "--resolve",
    "--no-discover",
    "--force-defaults",
    "--check-freshness",
    "--slice",
    "--radius",
    "--budget",
    "--include-pruned",
    "--compact",
    "--pack",
    "--pack-ecosystem",
    "--bus",
    "--tier",
    "--toc",
    "--section",
    "--show",
    "--set",
    "--clear",
    "--plan-id",
    "--status",
    "--phase",
    "--next",
    "--step-done",
    "--fix",
    "--check",
    "--index-dir",
    "--dry-run",
    "--target",
    "-t",
    "--all",
    "-a",
    "--dest",
    "-d",
    "--global",
    "-g",
    "--profile",
    "-p",
    "--archetype",
    "--hint",
    "--out-dir",
    "-o",
    "--prefix",
    "--quiet",
    "-q",
    "--list-profiles",
    "--prune",
    "--medallion",
    "--apply",
    "--raw-dir",
    "--processed-dir",
    "--json",
    "--probe"
  ],
  "signatures_1line": [
    "./FWengine.py::MiniYAML(class)",
    "./FWengine.py::safe_io_retry(operation: Callable[[], Any], max_attempts: int, initial_delay_ms: float) -> Any",
    "./FWengine.py::safe_rename_casing(src: Path, dest: Path) -> Path",
    "./FWengine.py::estimate_tokens_v4(text_or_path: Any, fast_stat_only: bool) -> int",
    "./FWengine.py::resolve_seed_key_files(root_path: Path) -> List[str]",
    "./FWengine.py::generate_beacon_content(folder: str, meta: Dict[str, Any], root_path: Optional[Path]) -> str",
    "./FWengine.py::resolve_beacon(dir_path: Path, root_path: Path) -> Dict[str, Any]",
    "./FWengine.py::extract_preserved_comments(beacon_file: Path) -> List[str]",
    "./FWengine.py::validate_beacon_data(data: Dict[str, Any]) -> List[str]",
    "./FWengine.py::validate_tree_data(data: Dict[str, Any]) -> List[str]",
    "./FWengine.py::validate_backlog_data(data: Dict[str, Any]) -> List[str]",
    "./FWengine.py::validate_backlog_queue(root_path: Path, check_only: bool) -> List[str]",
    "./FWengine.py::load_ignore_patterns(root_path: Path) -> List[str]",
    "./FWengine.py::is_ignored_path(dir_path: Path, root_path: Path, patterns: Optional[List[str]]) -> bool",
    "./FWengine.py::discover_unbeaconed_directories(root_path: Path) -> List[Path]",
    "./FWengine.py::infer_beacon_meta(dir_path: Path, root_path: Path) -> Dict[str, Any]",
    "./FWengine.py::scaffold_beacon_for_dir(dir_path: Path, root_path: Path, overwrite: bool) -> Optional[Path]",
    "./FWengine.py::ensure_beacon_chain(target_dir: Path, root_path: Path) -> List[Path]",
    "./FWengine.py::iter_beacon_files(root_path: Path) -> List[Path]",
    "./FWengine.py::sync_beacons(root_path: Path, auto_discover: bool, force_defaults: bool) -> int",
    "./FWengine.py::compute_topology_hash(root_path: Path) -> str",
    "./FWengine.py::compute_node_fingerprint(dir_path: Path) -> str",
    "./FWengine.py::generate_tree_json(root_path: Path) -> Dict[str, Any]",
    "./FWengine.py::check_satellite_freshness(root_path: Path) -> Dict[str, Any]",
    "./FWengine.py::format_compact_tree_json(data: Dict[str, Any]) -> str",
    "./FWengine.py::sync_tree(root_path: Path) -> Path",
    "./FWengine.py::generate_sliced_tree(root_path: Path, target_path: str, radius: int, max_children: int) -> Dict[str, Any]",
    "./FWengine.py::format_sliced_tree(data: Dict[str, Any]) -> str",
    "./FWengine.py::build_context_pack(root_path: Path, target_path: str, tier: str) -> Dict[str, Any]",
    "./FWengine.py::get_seed_sections(root_path: Path) -> List[Dict[str, Any]]",
    "./FWengine.py::extract_seed_section(root_path: Path, query: str) -> str",
    "./FWengine.py::manage_checkpoint(root_path: Path, action: str, plan_id: Optional[str], status: Optional[str], phase: Optional[str], next_action: Optional[str], completed_step: Optional[str]) -> Dict[str, Any]",